url,titre,date,sitename,type_source,type_doc,word_count,categorie_dominante,score_total,cluster,cluster_mots_cles,score_soutien_victime,score_remise_en_question,score_legitime_defense,score_discours_feministe,score_emprise_psychologique,score_silence_collectif,score_sensationnalisme,score_jugement_moral
https://france3-regions.franceinfo.fr/bourgogne-franche-comte/recit-femme-battue-violee-prostituee-valerie-bacot-tue-son-mari-23-victime-qui-ne-manque-personne-1854240.html,"RÉCIT. Femme battue, violée, prostituée, Valérie Bacot a tué son mari (2/3). Le mari, victime qui ne",2020-10-02,,article_presse,article,1461,silence_collectif,78,4,"bacot, valérie bacot, valérie, ans, daniel",5,7,8,0,4,35,4,15
https://france3-regions.franceinfo.fr/bourgogne-franche-comte/saone-et-loire/chalon-sur-saone/direct-valerie-bacot-femme-battue-qui-a-tue-son-mari-le-proces-commence-aux-assises-de-saone-et-loire-2142121.html,"Valérie Bacot : ""je voulais nous protéger de lui"", explique lors de son procès celle qui a tué son m",2021-06-21,,article_presse,article,3523,silence_collectif,206,4,"bacot, valérie bacot, valérie, ans, daniel",18,31,12,9,17,89,8,22
https://www.rtl.fr/actu/justice-faits-divers/crime-de-la-clayette-la-seconde-affaire-jacqueline-sauvage-7791251037,Crime de La Clayette : la seconde affaire Jacqueline Sauvage,2017-12-04,,article_presse,article,396,silence_collectif,45,0,"bacot, femmes, violences, valérie bacot, valérie",2,3,9,5,3,11,7,5
https://france3-regions.franceinfo.fr/bourgogne-franche-comte/saone-et-loire/macon/macon-6-mois-prison-sursis-requis-contre-enfants-affaire-clayette-1752567.html,Assassinat de La Clayette : les enfants condamnés à six mois de prison avec sursis pour recel de cad,2019-12-19,,article_presse,article,523,silence_collectif,54,0,"bacot, femmes, violences, valérie bacot, valérie",3,1,15,2,2,18,5,8
https://madame.lefigaro.fr/societe/valerie-bacot-proces-livre-femme-battue-violee-prostituee-par-son-mari-tout-le-monde-savait-230621-197039,"""Tout le monde savait"", le récit terrifiant de Valérie Bacot, battue, violée et prostituée par son m",2021-06-23,,article_presse,article,2189,silence_collectif,157,4,"bacot, valérie bacot, valérie, ans, daniel",19,10,6,5,12,74,12,19
https://www.lejsl.com/faits-divers-justice/2021/06/23/suivez-le-proces-de-valerie-bacot,Justice / Chalon-sur-Saône. Procès de Valérie Bacot : l'effroyable témoignage de la soeur de Daniel,2021-06-23,,article_presse,article,6010,silence_collectif,239,4,"bacot, valérie bacot, valérie, ans, daniel",28,24,19,9,19,78,14,48
https://web.archive.org/web/20210624204110/https://www.sudradio.fr/societe/la-mere-de-valerie-bacot-parle-damour-avec-son-mari-proxenete/,"La mère de Valérie Bacot parle d'""amour"" avec son mari proxénète - Sud Radio",2021-06-23,,article_presse,article,485,jugement_moral,18,4,"bacot, valérie bacot, valérie, ans, daniel",3,3,1,0,0,4,0,7
https://www.bfmtv.com/police-justice/une-petition-demande-la-liberte-pour-valerie-bacot-accusee-d-avoir-tue-son-mari-violent_AN-202101190267.html,"Une pétition demande la liberté pour Valérie Bacot, accusée d'avoir tué son mari violent",2021-01-19,,article_presse,article,470,silence_collectif,51,4,"bacot, valérie bacot, valérie, ans, daniel",6,5,7,2,5,20,1,5
https://france3-regions.franceinfo.fr/bourgogne-franche-comte/saone-et-loire/macon/valerie-bacot-a-nouveau-face-a-la-justice-suite-a-la-plainte-de-sa-mere-pour-diffamation-2308621.html,Valérie Bacot à nouveau face à la justice suite à la plainte de sa mère pour diffamation,2021-10-25,,article_presse,article,730,silence_collectif,29,4,"bacot, valérie bacot, valérie, ans, daniel",2,2,3,1,2,14,1,4
https://france3-regions.franceinfo.fr/bourgogne-franche-comte/recit-battue-violee-prostituee-valerie-bacot-tue-son-mari-13-epouse-victime-accusee-1854434.html,"RÉCIT. Battue, violée, prostituée, Valérie Bacot a tué son mari (1/3). L'épouse victime et accusée",2020-10-02,,article_presse,article,1786,silence_collectif,106,4,"bacot, valérie bacot, valérie, ans, daniel",2,9,10,0,3,60,7,15
https://www.20minutes.fr/justice/3064991-20210621-violences-conjugales-valerie-bacot-femme-battue-jugee-assassinat-mari-violent,"Valérie Bacot, une femme battue jugée pour l’assassinat de son mari violent",2021-06-21,,article_presse,article,1215,silence_collectif,74,4,"bacot, valérie bacot, valérie, ans, daniel",1,9,9,2,5,28,8,12
https://www.bfmtv.com/police-justice/proces/en-direct-valerie-bacot-jugee-pour-avoir-tue-son-mari-proxenete-suivez-le-proces_LN-202106210135.html,Fin de cette première journée de procès,2021-06-21,,article_presse,article,1234,silence_collectif,72,4,"bacot, valérie bacot, valérie, ans, daniel",8,3,6,1,9,35,2,8
https://www.tf1info.fr/justice-faits-divers/video-replay-tf1-sept-a-huit-l-interview-bouleversante-de-valerie-bacot-jugee-pour-avoir-tue-son-mari-qui-la-tyrannisait-2185510.html,"""Sept à Huit "" : l'interview bouleversante de Valérie Bacot, jugée pour avoir tué son mari qui la ty",2021-06-21,,article_presse,article,1317,silence_collectif,97,4,"bacot, valérie bacot, valérie, ans, daniel",13,9,6,0,10,46,4,9
https://www.lefigaro.fr/faits-divers/affaire-valerie-bacot-une-petition-pour-obtenir-la-grace-d-une-femme-que-personne-n-a-jamais-protegee-20210121,Affaire Valérie Bacot : une pétition pour obtenir la grâce d'une femme que «personne n'a jamais prot,2021-01-21,,article_presse,article,864,silence_collectif,58,4,"bacot, valérie bacot, valérie, ans, daniel",7,7,8,2,3,19,6,6
https://www.senat.fr/compte-rendu-commissions/20211101/ddf_bacot.html,Délégation aux droits des femmes : compte rendu de la semaine du 1er novembre 2021,2021-11-04,,article_presse,article,11090,silence_collectif,765,0,"bacot, femmes, violences, valérie bacot, valérie",95,51,81,35,54,296,36,117
https://france3-regions.franceinfo.fr/bourgogne-franche-comte/saone-et-loire/chalon-sur-saone/direct-valerie-bacot-elle-est-non-coupable-clame-l-un-des-enfants-de-la-femme-qui-a-tue-son-mari-violent-2147332.html,"Valérie Bacot : ""On avait une peur, qu'il se relève et nous tue"" témoignent les enfants de l'homme t",2021-06-22,,article_presse,article,2910,silence_collectif,162,4,"bacot, valérie bacot, valérie, ans, daniel",12,33,5,4,9,80,4,15
https://www.tf1.fr/tf1/chroniques-criminelles/videos/chroniques-criminelles-laffaire-valerie-bacot-le-meurtre-au-bout-de-lenfer-54646380.html,Chroniques criminelles - L'Affaire Valérie Bacot : Le meurtre au bout de l'enfer - Chroniques crimin,2025-09-28,,article_presse,article,164,remise_en_question,13,4,"bacot, valérie bacot, valérie, ans, daniel",1,4,1,0,2,2,2,1
https://www.parismatch.com/actu/societe/cetait-necessaire-victimes-de-violences-conjugales-elles-ont-tue-pour-survivre-269484,"« C’était nécessaire » : Victimes de violences conjugales, elles ont tué pour survivre",2026-05-23,,article_presse,article,3421,silence_collectif,182,4,"bacot, valérie bacot, valérie, ans, daniel",28,16,20,7,10,66,9,26
https://actu.orange.fr/videos/france/me-nathalie-tomasini-avocate-de-valerie-bacot-le-verdict-des-jures-de-la-cour-d-assises-de-chalon-sur-saone-fera-date-CNT000001C8b64.html,"Me Nathalie Tomasini, avocate de Valérie Bacot: ""Le verdict des jurés de la cour d'assises de Chalon",2021-06-25,,article_presse,article,168,jugement_moral,11,1,"bacot, valérie bacot, valérie, ans, prison",1,2,1,0,0,1,2,4
https://www.francetvpro.fr/contenu-de-presse/62763146,"Valérie Bacot, le dernier procès",2025-03-11,,article_presse,article,549,silence_collectif,48,0,"bacot, femmes, violences, valérie bacot, valérie",5,3,2,3,4,16,13,2
https://www.franceinfo.fr/faits-divers/justice-proces/proces-de-valerie-bacot/,Procès de Valérie Bacot,2016-03-13,,article_presse,article,1234,silence_collectif,128,1,"bacot, valérie bacot, valérie, ans, prison",12,9,25,10,7,40,6,19
https://www.publicsenat.fr/actualites/politique/violences-faites-aux-femmes-le-temoignage-glacant-de-valerie-bacot-191089,Violences faites aux femmes : le témoignage glaçant de Valérie Bacot,2021-11-04,,article_presse,article,1222,silence_collectif,112,0,"bacot, femmes, violences, valérie bacot, valérie",11,6,22,12,3,47,3,8
https://www.bfmtv.com/police-justice/proces/valerie-bacot-condamnee-a-4-ans-de-prison-dont-3-avec-sursis-elle-ne-retournera-pas-en-prison_AD-202106250438.html,"Valérie Bacot condamnée à 4 ans de prison dont 3 avec sursis, elle ne retournera pas en prison",2021-06-25,,article_presse,article,292,silence_collectif,25,1,"bacot, valérie bacot, valérie, ans, prison",0,3,4,1,0,8,1,8
https://www.tf1.fr/novo19/valerie-bacot-pourquoi-jai-tue-mon-mari/videos/replay,Replay de Valérie Bacot : Pourquoi j'ai tué mon mari (Documentaire) | TF1+,2026-01-12,,article_presse,article,155,sensationnalisme,20,4,"bacot, valérie bacot, valérie, ans, daniel",0,0,0,0,0,5,15,0
https://france3-regions.franceinfo.fr/bourgogne-franche-comte/saone-et-loire/chalon-sur-saone/valerie-bacot-le-dernier-proces-un-premier-pas-vers-la-reconnaissance-du-syndrome-de-la-femme-battue-2877197.html,"Valérie Bacot, le dernier procès : un premier pas vers la reconnaissance du syndrome de la femme bat",2023-11-25,,article_presse,article,1156,silence_collectif,100,4,"bacot, valérie bacot, valérie, ans, daniel",9,8,14,5,14,32,9,9
https://www.bfmtv.com/police-justice/valerie-bacot-videe-mentalement-et-physiquement-applaudie-en-sortant-libre-du-tribunal_AV-202106250467.html,"Valérie Bacot, ""vidée mentalement et physiquement"", applaudie en sortant libre du tribunal",2021-06-25,,article_presse,article,190,jugement_moral,14,1,"bacot, valérie bacot, valérie, ans, prison",2,3,0,0,0,3,0,6
https://www.ici.fr/infos/faits-divers-justice/valerie-bacot-condamnee-a-3-ans-de-prison-avec-sursis-pour-avoir-tue-son-mari-proxenete-ressort-1624646394,"Valérie Bacot, condamnée à 3 ans de prison avec sursis pour avoir tué son mari proxénète, est libre ",2021-06-25,,article_presse,article,752,silence_collectif,71,1,"bacot, valérie bacot, valérie, ans, prison",9,8,9,2,7,19,4,13
https://www.20minutes.fr/justice/3070523-20210625-violences-conjugales-accusation-demande-reincarcerer-valerie-bacot-tue-mari-proxenete,"Valérie Bacot ne doit pas retourner en prison, demande l'avocat général",2021-06-25,,article_presse,article,772,silence_collectif,60,1,"bacot, valérie bacot, valérie, ans, prison",6,7,8,3,7,17,2,10
https://www.bfmtv.com/police-justice/il-nous-donnait-des-coups-nous-jetait-par-terre-au-proces-de-valerie-bacot-les-enfants-racontent-la-violence-de-leur-pere_AV-202106220316.html,"""Il nous donnait des coups, nous jetait par terre"": au procès de Valérie Bacot, les enfants raconten",2021-06-22,,article_presse,article,335,silence_collectif,23,4,"bacot, valérie bacot, valérie, ans, daniel",1,2,0,0,4,12,0,4
https://www.marianne.net/societe/police-et-justice/condamnee-pour-la-mort-de-son-mari-valerie-bacot-veut-raconter-pour-que-ca-serve,"Condamnée pour la mort de son mari, Valérie Bacot veut ""raconter pour que ça serve""",2021-12-03,,article_presse,article,829,silence_collectif,60,4,"bacot, valérie bacot, valérie, ans, daniel",8,8,1,6,6,17,2,12
https://www.lanouvellerepublique.fr/a-la-une/la-vive-emotion-provoquee-par-le-proces-de-valerie-bacot,La vive émotion provoquée par le procès de Valérie Bacot,2021-06-23,,article_presse,article,995,legitime_defense,79,4,"bacot, valérie bacot, valérie, ans, daniel",13,3,25,3,2,24,6,3
https://www.la-croix.com/France/Violences-conjugales-proces-Valerie-Bacot-fera-date-selon-avocate-2021-06-27-1201163447,Violences conjugales : le procès de Valérie Bacot « fera date » selon son avocate,2021-06-27,,article_presse,article,645,legitime_defense,55,1,"bacot, valérie bacot, valérie, ans, prison",6,5,13,2,6,12,2,9
https://www.bfmtv.com/police-justice/proces-de-valerie-bacot-ses-enfants-temoignent_VN-202106220284.html,Procès de Valérie Bacot: ses enfants témoignent,2021-06-22,,article_presse,article,242,silence_collectif,20,0,"bacot, femmes, violences, valérie bacot, valérie",1,1,1,2,0,14,1,0
https://france3-regions.franceinfo.fr/bourgogne-franche-comte/saone-et-loire/chalon-sur-saone/proces-de-valerie-bacot-comment-interpreter-sa-condamnation-a-quatre-ans-de-prison-dont-trois-avec-sursis-2154523.html,Procès de Valérie Bacot : comment interpréter sa condamnation à quatre ans de prison dont trois avec,2021-06-26,,article_presse,article,829,jugement_moral,94,1,"bacot, valérie bacot, valérie, ans, prison",7,10,13,11,12,13,1,27
https://www.rtl.fr/actu/justice-faits-divers/affaire-valerie-bacot-la-nouvelle-jacqueline-sauvage-temoigne-sur-w9-7800866390,"Affaire Valérie Bacot : la ""nouvelle Jacqueline Sauvage"" témoigne sur W9",2020-09-30,,article_presse,article,314,silence_collectif,24,4,"bacot, valérie bacot, valérie, ans, daniel",1,1,5,0,0,13,1,3
https://www.europe1.fr/societe/valerie-bacot-condamnee-a-une-peine-symbolique-justice-a-ete-rendue-estime-son-avocate-4054122,"Valérie Bacot condamnée à une peine symbolique : ""Justice a été rendue"", estime son avocate",2021-06-26,,article_presse,article,251,silence_collectif,23,1,"bacot, valérie bacot, valérie, ans, prison",2,3,5,1,0,6,0,6
https://www.tf1info.fr/justice-faits-divers/video-je-vais-pouvoir-retrouver-mes-enfants-libre-valerie-bacot-ovationnee-a-la-sortie-du-tribunal-2189844.html,"VIDÉO - ""Je vais pouvoir retrouver mes enfants"" : libre, Valérie Bacot ovationnée à la sortie du tri",2021-06-26,,article_presse,article,617,silence_collectif,58,1,"bacot, valérie bacot, valérie, ans, prison",11,5,8,1,5,16,0,12
https://france3-regions.franceinfo.fr/bourgogne-franche-comte/saone-et-loire/chalon-sur-saone/valerie-bacot-il-est-indispensable-que-la-loi-passe-autour-de-ce-crime-plaide-l-avocate-des-parties-civiles-2152363.html,Valérie Bacot : les avocates demandent l'acquittement de la femme qui a tué son mari,2021-06-24,,article_presse,article,2103,silence_collectif,167,4,"bacot, valérie bacot, valérie, ans, daniel",31,34,5,12,12,46,5,22
https://www.gala.fr/l_actu/news_de_stars/exclu-gala-valerie-bacot-son-depart-en-prison-organise-et-sous-controle-avant-son-proces_480151,EXCLU - Valérie Bacot : son départ en prison organisé et sous contrôle avant son procès,2021-11-07,,article_presse,article,516,silence_collectif,39,4,"bacot, valérie bacot, valérie, ans, daniel",6,1,1,1,3,15,1,11
https://www.franceinfo.fr/faits-divers/justice-proces/proces-de-valerie-bacot-ma-mere-est-non-coupable-clament-ses-enfants-au-deuxieme-jour-du-proces_4674575.html,"Procès de Valérie Bacot : ""Elle est non coupable"", clament ses enfants au deuxième jour du procès",2021-06-22,,article_presse,article,741,silence_collectif,42,4,"bacot, valérie bacot, valérie, ans, daniel",2,9,2,0,3,16,6,4
https://www.rtl.fr/actu/justice-faits-divers/proces-de-valerie-bacot-j-ai-ete-naive-confie-sa-mere-a-la-barre-7900048715,"Procès de Valérie Bacot : ""J'ai été naïve"", confie sa mère à la barre",2021-06-23,,article_presse,article,492,jugement_moral,23,4,"bacot, valérie bacot, valérie, ans, daniel",3,1,2,0,0,7,1,9
https://www.tf1info.fr/justice-faits-divers/proces-de-valerie-bacot-la-partie-civile-reclame-une-condamnation-pour-l-exemple-2189758.html,Procès de Valérie Bacot : la partie civile réclame une condamnation pour l’exemple | TF1 Info,2021-06-25,,article_presse,article,420,remise_en_question,43,4,"bacot, valérie bacot, valérie, ans, daniel",1,10,7,2,7,9,3,4
https://www.bfmtv.com/societe/le-temoignage-glacant-de-valerie-bacot-victime-de-violences-conjugales_AN-202105260005.html,"Le témoignage glaçant de Valérie Bacot, victime de violences conjugales",2021-05-26,,article_presse,article,556,silence_collectif,44,4,"bacot, valérie bacot, valérie, ans, daniel",5,2,4,3,4,18,1,7
https://www.lefigaro.fr/faits-divers/notre-mere-nous-a-dit-qu-elle-avait-tue-notre-pere-au-proces-bacot-les-enfants-de-l-accusee-et-de-la-victime-a-la-barre-20210622,"«Notre mère nous a dit qu'elle avait tué notre père» : au procès Bacot, les enfants de l'accusée et ",2021-06-22,,article_presse,article,920,silence_collectif,55,4,"bacot, valérie bacot, valérie, ans, daniel",5,6,3,0,2,23,6,10
https://www.franceinfo.fr/faits-divers/justice-proces/proces-de-valerie-bacot-cinq-ans-de-prison-requis-dont-quatre-avec-sursis-contre-cette-femme-qui-a-tue-son-mari-violent-et-proxenete_4677797.html,"Procès de Valérie Bacot : cinq ans de prison requis, dont quatre avec sursis, contre cette femme qui",2021-06-25,,article_presse,article,665,silence_collectif,46,1,"bacot, valérie bacot, valérie, ans, prison",5,2,4,0,7,16,2,10
https://www.parismatch.com/Actu/Societe/L-avocat-general-requiert-la-clemence-forte-emotion-au-proces-de-Valerie-Bacot-1744528,L'avocat général requiert la clémence : forte émotion au procès de Valérie Bacot,2021-06-25,,article_presse,article,712,silence_collectif,61,1,"bacot, valérie bacot, valérie, ans, prison",6,7,10,3,8,17,2,8
https://www.ici.fr/emissions/la-scene-culture/tout-le-monde-savait-avec-sylvie-testud-l-histoire-de-valerie-bacot-mise-en-scene,"“Tout le monde savait” avec Sylvie Testud, l’histoire de Valérie Bacot mise en scène - ICI",2022-10-27,,article_presse,article,473,silence_collectif,40,2,"scène, testud, sylvie testud, sylvie, théâtre",3,4,0,1,3,23,5,1
https://www.tf1info.fr/justice-faits-divers/video-condamnee-pour-l-assassinat-de-son-mari-violent-valerie-bacot-ne-retournera-pas-en-prison-2189870.html,"Condamnée pour l'assassinat de son mari violent, Valérie Bacot ne retournera pas en prison | TF1 Inf",2021-06-25,,article_presse,article,167,jugement_moral,15,1,"bacot, valérie bacot, valérie, ans, prison",2,0,0,0,1,4,0,8
https://www.lejsl.com/faits-divers-justice/2021/06/25/proces-de-valerie-bacot-l-heure-du-verdict,"Justice. Valérie Bacot libre : ""Un nouveau combat maintenant, pour toutes les autres femmes""",2021-06-25,,article_presse,article,960,jugement_moral,69,1,"bacot, valérie bacot, valérie, ans, prison",12,6,7,1,2,13,8,20
"https://television.telerama.fr/tele/programmes-tv/valerie-bacot-pourquoi-jai-tue-mon-mari,192564444.php",Valérie Bacot : pourquoi j'ai tué mon mari,2016-03-13,,article_presse,article,147,silence_collectif,10,3,"justice, valérie, femme, vie, enfants",2,1,0,0,1,3,2,1
https://www.franceinfo.fr/faits-divers/justice-proces/proces-de-valerie-bacot/proces-de-valerie-bacot-son-avocate-reclame-l-acquittement-de-cette-femme-qui-a-tue-son-mari-violent-et-proxenete_4678089.html,"Valérie Bacot, condamnée à quatre ans de prison dont trois avec sursis pour l'assassinat de son mari",2021-06-25,,article_presse,article,800,silence_collectif,62,1,"bacot, valérie bacot, valérie, ans, prison",3,5,7,1,8,23,4,11
https://www.lefigaro.fr/faits-divers/proces-bacot-dans-cette-histoire-il-n-y-a-rien-qui-va-du-debut-a-la-fin-20210621,"Procès Bacot : «Dans cette histoire, il n'y a rien qui va, du début à la fin»",2021-06-21,,article_presse,article,1153,silence_collectif,52,4,"bacot, valérie bacot, valérie, ans, daniel",8,8,3,0,3,22,3,5
https://www.bfmtv.com/societe/affaire-valerie-bacot-accusee-d-avoir-tue-son-mari-violent-personne-ne-lui-a-tendu-la-main_AN-202101210006.html,"Affaire Valérie Bacot, accusée d'avoir tué son mari violent: ""Personne ne lui a tendu la main""",2021-01-21,,article_presse,article,451,silence_collectif,38,4,"bacot, valérie bacot, valérie, ans, daniel",7,3,4,1,5,8,2,8
https://www.senat.fr/rap/r22-933/r22-933_mono.html,Cérémonie de remise du Prix 2023 de la délégation aux droits des femmes - 19 septembre 2023 - Sénat,2023-09-27,,article_presse,article,7618,silence_collectif,338,0,"bacot, femmes, violences, valérie bacot, valérie",33,9,65,50,8,131,12,30
https://www.marianne.net/societe/police-et-justice/valerie-bacot-jugee-pour-lassassinat-de-son-mari-600-000-francais-reclament-sa-liberte,Valérie Bacot jugée pour l'assassinat de son mari : 600 000 Français réclament sa liberté,2021-06-22,,article_presse,article,661,legitime_defense,54,4,"bacot, valérie bacot, valérie, ans, daniel",8,8,12,4,4,8,6,4
https://france3-regions.franceinfo.fr/bourgogne-franche-comte/saone-et-loire/chalon-sur-saone/violee-frappee-prostituee-valerie-bacot-24-ans-sous-emprise-jusqu-a-tuer-son-mari-2126245.html,"Violée, frappée, prostituée : Valérie Bacot, 24 ans sous emprise jusqu'à tuer son mari",2021-06-12,,article_presse,article,1654,silence_collectif,101,4,"bacot, valérie bacot, valérie, ans, daniel",11,12,5,5,10,38,2,18
https://www.bfmtv.com/police-justice/affaire-valerie-bacot-qu-est-ce-que-le-syndrome-de-la-femme-battue_AN-202106290501.html,"Affaire Valérie Bacot: qu'est-ce que le ""syndrome de la femme battue""?",2021-06-29,,article_presse,article,564,emprise_psychologique,59,4,"bacot, valérie bacot, valérie, ans, daniel",4,7,7,10,13,13,2,3
https://france3-regions.franceinfo.fr/bourgogne-franche-comte/saone-et-loire/chalon-sur-saone/direct-valerie-bacot-mon-pere-ne-me-manque-pas-affirme-l-un-des-fils-de-la-femme-victime-de-violences-conjugales-2148997.html,"Valérie Bacot : le mari violent, une victime que personne ne regrette",2021-06-23,,article_presse,article,3488,silence_collectif,141,4,"bacot, valérie bacot, valérie, ans, daniel",19,17,4,8,14,62,4,13
https://www.lejsl.com/faits-divers-justice/2021/06/18/comment-l-affaire-valerie-bacot-est-devenue-un-sujet-national,Justice. Comment l’affaire Valérie Bacot est devenue un sujet national,2021-06-18,,article_presse,article,178,remise_en_question,11,0,"bacot, femmes, violences, valérie bacot, valérie",2,3,1,0,1,2,2,0
https://www.la-croix.com/mere-Valerie-Bacot-parle-amour-mari-proxenete-2021-06-23-1301162763,"La mère de Valérie Bacot parle d'""amour"" avec son mari proxénète",2021-06-23,,article_presse,article,475,jugement_moral,18,4,"bacot, valérie bacot, valérie, ans, daniel",3,3,1,0,0,4,0,7
https://www.lejsl.com/faits-divers-justice/2024/11/30/faites-entrer-l-accuse-ce-dimanche-que-devient-valerie-bacot,Saône-et-Loire. “Faites entrer l’accusé” ce dimanche : que devient Valérie Bacot ?,2024-11-30,,article_presse,article,216,silence_collectif,12,0,"bacot, femmes, violences, valérie bacot, valérie",1,2,3,0,0,4,2,0
https://www.lejsl.com/faits-divers-justice/2021/06/25/faits-divers-justice-2021-06-25,"En direct. Pas d'incarcération requise contre Valérie Bacot, la défense plaide l'acquittement",2021-06-25,,article_presse,article,4935,silence_collectif,323,4,"bacot, valérie bacot, valérie, ans, daniel",27,35,33,14,36,101,24,53
https://www.bfmtv.com/police-justice/proces-de-valerie-bacot-elle-n-avait-d-autre-echappatoire-que-de-tuer-son-mari-proxenete-selon-des-experts_AD-202106240373.html,"Procès de Valérie Bacot: elle n'avait d'autre ""échappatoire"" que de tuer son mari proxénète, selon d",2021-06-24,,article_presse,article,450,emprise_psychologique,40,4,"bacot, valérie bacot, valérie, ans, daniel",1,6,5,4,13,7,0,4
https://www.tf1info.fr/justice-faits-divers/video-proces-de-valerie-bacot-un-verdict-qui-fera-date-2189917.html,Procès de Valérie Bacot : un verdict qui fera date | TF1 Info,2021-06-26,,article_presse,article,229,jugement_moral,29,1,"bacot, valérie bacot, valérie, ans, prison",5,4,3,2,2,4,2,7
https://www.lejsl.com/societe/2023/09/20/valerie-bacot-decoree-de-la-medaille-de-la-delegation-aux-droits-des-femmes,Saône-et-Loire. Valérie Bacot décorée de la médaille de la délégation aux droits des femmes,2023-09-20,,article_presse,article,243,silence_collectif,22,1,"bacot, valérie bacot, valérie, ans, prison",0,1,6,3,1,8,1,2
https://www.sudouest.fr/proces-de-valerie-bacot-les-enfants-defendent-leur-mere-3874367.php,"Procès de Valérie Bacot, qui a tué son mari bourreau : les enfants défendent leur mère",2021-06-22,,article_presse,article,349,silence_collectif,22,4,"bacot, valérie bacot, valérie, ans, daniel",2,0,0,0,2,14,0,4
https://france3-regions.franceinfo.fr/bourgogne-franche-comte/saone-et-loire/chalon-sur-saone/valerie-bacot-les-10-personnalites-phares-du-proces-2152939.html,Valérie Bacot : les 10 personnalités phares du procès,2021-06-26,,article_presse,article,2044,soutien_victime,111,4,"bacot, valérie bacot, valérie, ans, daniel",31,5,5,9,9,29,7,16
https://www.lejsl.com/faits-divers-justice/2021/01/08/une-petition-en-faveur-de-valerie-bacot-depasse-les-55-000-signatures-en-moins-d-une-semaine,Crime de La Clayette. Une pétition en faveur de Valérie Bacot dépasse les 55 000 signatures en moins,2021-01-08,,article_presse,article,303,silence_collectif,33,4,"bacot, valérie bacot, valérie, ans, daniel",8,2,1,0,2,13,5,2
https://www.cesoirtv.com/news/actu/420-valerie-bacot-que-devient-celle-qui-a-ete-reconnue-coupable-du-meurtre-de-son-mari-daniel-polette-mais-qui-est-sortie-libre-de-son-proces/,Valérie Bacot : Que devient celle qui a été reconnue coupable du meurtre de son mari Daniel Polette ,2025-11-23,,article_presse,article,518,jugement_moral,36,4,"bacot, valérie bacot, valérie, ans, daniel",5,3,5,2,2,8,1,10
https://www.elle.fr/Societe/News/Valerie-Bacot-liberee-a-la-fin-de-son-proces-loin-des-passions-outragees-3933985,"Valérie Bacot libre à la fin de son procès, loin des passions outragées - Elle",2021-06-26,,article_presse,article,212,silence_collectif,18,1,"bacot, valérie bacot, valérie, ans, prison",5,0,1,0,1,6,0,5
https://www.lejsl.com/faits-divers-justice/2021/06/22/les-avocates-de-valerie-bacot-assignent-l-etat-en-justice,Justice. Une avocate de Valérie Bacot assigne l'Etat en justice,2021-06-22,,article_presse,article,215,soutien_victime,11,4,"bacot, valérie bacot, valérie, ans, daniel",5,1,0,0,0,1,0,4
